"issue_id","issue","affected_count","scope","baseline","target","planned_action","evidence_source","owner","status"
"SEO-001","Homepage canonicalization applied to 124 public URLs","124","page-level canonical","124 HOMEPAGE_CANONICAL","0","Metadata Factory emits self-canonical for every indexable public page and primary host normalization handles bare-host duplicates.","audit/04-production-url-inventory.csv","SEO_GEO","PLANNED"
"SEO-002","Sitemap includes 6 category URLs that currently return 404 on primary host","6","sitemap + route restoration","6 sitemap 404","0","Restore category landing pages at the same URLs, then keep them in sitemap only after 200 validation.","audit/04-production-url-inventory.csv","URL_AGENT","PLANNED"
"SEO-003","No hreflang coverage","0 current pages with hreflang","i18n metadata","0","all paired zh-CN/en pages","Generate zh-CN, en and x-default hreflang from locale registry and route pairing matrix.","audit/04-production-url-inventory.csv","I18N","PLANNED"
"SEO-004","Missing meta description on public pages","5","metadata completeness","5","0","Metadata Factory requires description input per template and blocks fallback to empty value.","audit/04-production-url-inventory.csv","SEO_GEO","PLANNED"
"SEO-005","Slug-like or low-quality Title/H1 patterns","UNVERIFIED_CLUSTER","title and heading quality","present on current pages","0 slug-derived titles on approved templates","Template-level title rules require entity title, model and category context instead of raw slug echoes.","audit/06-content-inventory.csv","IA","PLANNED"
"SEO-006","Public 200 URLs outside sitemap","52","sitemap inclusion","52","0 undecided public URLs","Classify each as canonical page to include, redirecting duplicate, or internal-only page excluded by policy.","audit/04-production-url-inventory.csv","SEO_GEO","PLANNED"
